{
  "$schema": "https://json-schema.org/draft/2020-12/schema",
  "$id": "tenra-facet.orientation-packet.v1",
  "title": "Facet orientation packet",
  "type": "object",
  "additionalProperties": true,
  "required": [
    "schema",
    "exportedAt",
    "sourceApp",
    "query",
    "response",
    "handoff"
  ],
  "properties": {
    "schema": {
      "const": "tenra-facet.orientation-packet.v1",
      "type": "string"
    },
    "exportedAt": {
      "type": "string"
    },
    "sourceApp": {
      "type": "string"
    },
    "query": {
      "type": "object"
    },
    "response": {
      "type": "object"
    },
    "handoff": {
      "type": "object"
    }
  },
  "x-tenra": {
    "ownerApp": "facet",
    "producerApp": "facet",
    "consumerApps": [
      "derive",
      "assembly",
      "sentinel"
    ],
    "fixture": "tenra Facet/fixtures/handoffs/orientation-packet.json",
    "correlationFields": [
      "handoff.packetId"
    ],
    "standardControls": [
      "schema badge",
      "endpoint health",
      "retry failed",
      "payload inspection",
      "history"
    ]
  }
}
