{
  "schema": "tenra-facet.orientation-packet.v1",
  "exportedAt": "2026-05-06T17:30:00.000Z",
  "sourceApp": "facet",
  "query": {
    "id": "facet_query_demo",
    "text": "How should I evaluate a local service provider?",
    "submittedAt": "2026-05-06T17:29:00.000Z",
    "locale": "en-US"
  },
  "response": {
    "search": {
      "query": {
        "id": "facet_query_demo",
        "text": "How should I evaluate a local service provider?",
        "submittedAt": "2026-05-06T17:29:00.000Z",
        "locale": "en-US"
      },
      "results": [],
      "safetyDisposition": "allow"
    },
    "reframing": {
      "query": {
        "id": "facet_query_demo",
        "text": "How should I evaluate a local service provider?",
        "submittedAt": "2026-05-06T17:29:00.000Z",
        "locale": "en-US"
      },
      "block": {
        "id": "orientation_demo",
        "mode": "compare",
        "heading": "Compare claims, evidence, and unresolved risk.",
        "line": "Use multiple result types before deciding.",
        "followups": [
          {
            "id": "followup_demo",
            "prompt": "What evidence supports the strongest claim?"
          }
        ],
        "relatedConcepts": [
          {
            "id": "concept_demo",
            "label": "Evidence quality",
            "queryHint": "local service provider evidence quality"
          }
        ]
      },
      "safetyDisposition": "allow"
    }
  },
  "handoff": {
    "recommendedNextApp": "derive",
    "prompt": "Compare claims, evidence, and unresolved risk.\nUse multiple result types before deciding.\nWhat evidence supports the strongest claim?",
    "notes": [
      "Preserve result provenance, commonality, and uncertainty."
    ]
  }
}
